{
  "schema_version": "1.0.0",
  "message_type": "OHLC_1M",
  "publisher_sequence": 102,
  "published_ts_ns": 1788566460001000000,
  "payload": {
    "schema_version": "1.0.0",
    "venue": "BINANCE",
    "instrument_id": "BTC-USDT-SPOT",
    "interval": "1m",
    "open_ts_ns": 1788566400000000000,
    "close_ts_ns": 1788566460000000000,
    "open_ts_utc": "2026-09-05T00:00:00+00:00",
    "close_ts_utc": "2026-09-05T00:01:00+00:00",
    "is_final": true,
    "sample_count": 527,
    "first_event_id": "sample-binance-event-1",
    "last_event_id": "sample-binance-event-527",
    "bid_open": "59999.90",
    "bid_high": "60012.10",
    "bid_low": "59992.20",
    "bid_close": "60008.40",
    "ask_open": "60000.10",
    "ask_high": "60012.30",
    "ask_low": "59992.40",
    "ask_close": "60008.60",
    "mid_open": "60000.00",
    "mid_high": "60012.20",
    "mid_low": "59992.30",
    "mid_close": "60008.50",
    "spread_open": "0.20",
    "spread_high": "0.50",
    "spread_low": "0.10",
    "spread_close": "0.20"
  }
}
