{"schema_version":"1.0.0","message_type":"LTP_OHLC_1M","publisher_sequence":4,"published_ts_ns":1700000040000000000,"payload":{"schema_version":"1.0.0","venue":"BINANCE","instrument_id":"BTC-USDT-SPOT","interval":"1m","open_ts_ns":1699999980000000000,"close_ts_ns":1700000040000000000,"open_ts_utc":"2023-11-14T22:13:00+00:00","close_ts_utc":"2023-11-14T22:14:00+00:00","is_final":true,"trade_count":4,"first_trade_event_id":"sample-trade-1","last_trade_event_id":"sample-trade-4","open":"37000.10","high":"37005.00","low":"36998.50","close":"37002.25","base_volume":"0.012","quote_volume":"444.019"}}
