{"schema_version":"1.0.0","message_type":"TRADE","publisher_sequence":3,"published_ts_ns":1700000000100000000,"payload":{"schema_version":"1.0.0","event_id":"sample-trade-1","venue":"BINANCE","instrument_id":"BTC-USDT-SPOT","symbol":"BTCUSDT","trade_id":"12345","exchange_ts_ns":1700000000000000000,"source_ts_ns":1700000000000000000,"receive_ts_ns":1700000000050000000,"price":"37000.10","quantity":"0.002","aggressor_side":"BUY","raw_ref":"sample-raw-trade-1","adapter_version":"binance-trade-v1","native":{}}}
